I don't let you.;Eu não deixo você.
She lets me go.;Ela me deixa ir.
I don't let you date him. ;Eu não deixo você namorar ele.
She has lets her sister go to the party.;Ela deixou a irmã dela ir a festa.
I let my dog sleep inside the house.;Eu deixo meu cachorro dormir dentro de casa.
We would not let her go.;Nós não deixariamos ela ir.
Do you let her open the window at night?;Vocês deixam ela abrir a janela a noite?
Tomorrow I will you let come.;Amanhã eu deixarei você vir.
Have you gone straight? ;Você foi reto?
I went yesterday through the door.;Eu fui ontem através da porta.
I will go tomorrow.;Eu irei amanhã.
I went yesterday to Campinas.;Eu fui ontem a Campinas.
He has gone to the restaurant.;Ele foi ao restaurante.
I will go by foot.;Eu irei a pé.
Did you go to the wedding last weekend?;Você foi ao casamento final de semana passado?
Where do you go on vacations?;Onde você vai nas férias?
Come here?;Vem aqui?
Has not she come?;Ela não veio?
Will you come to the class?;Você virá para aula?
Is she coming?;Ela está vindo?
She is not coming back.;Ela não está voltando.
Do you come by motorcycle? ;Você vem de moto?
She came by foot yesterday.;Ela veio a pé ontem.
He came reading yesterday.;Ele veio lendo ontem.
He comes from the moon.;Ele vem da lua.
She comes from a good family.;Ela vem de uma boa família.
Have you traveled to London?;Você viajou para Londres?
Have you ever traveled to London?;Você já viajou para Londres?
I want to travel this year.;Eu quero viajar este ano.
She has never traveled on her life.;Ela nunca viajou na vida dela.
They will travel tomorrow in the morning.;Eles viajaram amanhã de manhã.
I would like to travel to  Japan.;Eu gostaria de viajar para o Japão.
How do you prefer to travel: by plane or by train?;Como você prefere viajar de avião ou trem?
I traveled one hundred kilometers by bike last year.;Eu viajei 100 km de bicicleta ano passado.
He doesn't like to travel.;Ele não gosta de viajar.
I arrived early yesterday.;Eu cheguei mais cedo ontem.
She didn't arrive in home yet.;Ela não chegou em casa ainda.
What time will you arrive tomorrow?;Que horas você chegará amanhã?
I would like you arrive soon.;Eu gostaria que você chegasse cedo.
How will you arrive home?;Como você vai chegar em casa?
He arrives at midday every day.;Ele chega ao meio dia todos os dias.
You have never arrived late in your life.;Você nunca chegou atrasado na vida.
What time does she arrive at school? ;Que horas ela chega na escola?
I always arrive around seven.;Eu sempre chego por volta das sete.
He doesn't like to arrive late. ;Ele não gosta de chegar tarde.
Do you drive truck?;Você dirige caminhão? 
I don't drive at night.;Eu não dirijo a noite.
She drove to college yesterday.;Ela dirigiu para a faculdade ontem.
He drives very well.;Ele dirige muito bem.
Does she drive frequently?;Ela dirige frequentemente?
When do you prefer to drive, in the morning or at night?;Quando você preferi dirigir, de manhã ou a noite?
I would like to drive through Europe.;Eu gostaria de dirigir pela Europa.
He doesn't drive because he is afraid.;Ele não dirige, porque ele é medroso.
You will drive all the year with this car.;Você dirigirá o ano inteiro com esse carro.
I rarely ride by bike.;Eu raramente ando de bicicleta.
She doesn't ride a horse.;Ela não anda de cavalo.
Will you ride a motorcycle on the weekend? ;Você andará de moto no fim de semana? 
I have already ridden by horse.;Eu já andei de cavalo.
He loved to ride a bike on his vacations.;Ele amou andar de bicicleta nas férias.
Would you like to ride a horse around the farm?;Você gostaria de andar de cavalo pela fazenda?
She wishes to ride a motorcycle.;Ela deseja andar de moto.
I ride by bike because it is relaxing.;Eu ando de bicicleta por que é relaxante.
Do you try to ride a horse when you go to the countryside?;Você tenta andar a cavalo quando vai ao campo?
He rode by bike on his childhood.;Ele andou de bicicleta na infância.
She walks at the zoo every Saturday.;Ela caminha no zoológico todo sábado.
Does she like to walk at the park with you?;Ela gosta de caminhar no parque com você? 
I prefer to walk at night on well-lighted streets .;Eu prefero caminhar a noite em ruas bem iluminadas.
How many miles have you walked for?;Por quantas milhas você andou?
She doesn't like to walk in the morning.;Ela não gosta de andar de manhã.
Why does she never walk with us?;Por que ela nunca caminha conosto?
My father walks everyday since I was a child.;Meu pai caminha todos os dias desde que eu era criança.
Did you walk yesterday?;Você caminhou ontem?
I can't run without tennis.;Eu não posso correr sem tênis.
She runs with her mother.;Ela corre com a mãe dela.
What time do you usually run?;Quem horas você geralmente corre?
I ran for five miles to meet you.;Eu corri por cinco milhas para encontrar vocês.
How often do they run?;Com que frequência eles correm?
She has never needed to run for her life. ;Ela nunca precisou correr por sua vida.
Could I run with you?;Eu poderia correr com você?
She used to run after breakfast.;Ela costumava correr depois do cafê da manhã.
I was thinking in I run the marathon.;Eu estava pensando em correr a maratona.;Procurar e estudar regra.
Would we run together to lose weight?;Nós correríamos juntos para perder peso?
I don't park on the street.;Eu não estaciono na rua.
She has parked at the mall's parking.;Ela estacionou no estacionamento do shopping.
How much is paring here?;Quanto custa estacionar aqui?
She likes to skate at the park.;Ela gosta de patinar no parque.
I skated when I was a child.;Eu patinava quando criança.
Do you skate professionally?;Você patina profissionalmente?
I waited a thousand years.;Eu esperei mil anos.
I have waited my son to arriving.;Eu esperei meu filho chegar.
She waits my father for three hours.;Ela espera meu pai por 3 horas.
She has waited to cool.;Ela esperou esfriar.
Could you wait for me? ;Você poderia me esperar?
He waited for his love for two years.;Ele esperou pelo seu amor por dois anos.
How long will I need to wait? ;Quanto tempo eu precisarei esperar?
I have chosen to wait.;Eu escolhi esperar.
I hope to win the lottery.;Eu espero ganhar na loteria.
He hopes having a beautiful wife.;Ele espera ter uma linda esposa.;Estudar regra.Ver se é present continuons
I hope so.;Eu espero que sim.
I don't hope so.;Eu espero que não.
I will hope.;Eu esperarei com esperança.
I'm going to hope.;Eu esperarei com esperança.
I hope you forgive me.;Eu espero que você me perdoe.
She hopes to get a scholarship.;Ela espera conseguir uma bolsa de estudos.
Do you hope Brazil get better?;Você espera que o Brasil melhore?
He hoped to be loved for her until the end.;Ele esperou ser amado por ela até o fim.
I expect to go to Salvador./ I can't wait to go to Salvador.;Eu mal posso esperar para ir a Salvador.
I have expect gnawing my nails.;Eu esperei roendo a unha.
I expect that doesn't rain.;Eu espero que não chova.
How tall do you expect to be? ;Quão alto você espera ser?
I am expecting a baby.;Eu estou esperando um bebê.
Do you expect to finish the book this year? ;Você espera terminar o livro esse ano?
He expects his vacations.;Ele espera a suas férias.
I expect to read many books until the end of the semester;Eu espero ler muitos livros até o fim do semestre.
Let me help you./ Let me aid you.;Deixa-me ajudar você.
Would you help me? /Would you aid me? ;Você me ajudaria?
She will aid me tomorrow.;Ela me ajudará amanhã.
Does he aid your family?;Ele ajuda a sua família?
The straight-A student has helped me./The straight-A student has aided me;A CDF me ajudou.
I would help my friend.;Eu socorreria a minha amiga.
I have helped.;Eu socorri.
Who have you helped?;Quem você socorreu?
My physician has had to help me.;Meu médico teve que me socorrer.
I attended in 2000 year that course.;Eu cursei no ano 2000 aquele curso.
I have attended that course, do you remember? ;Eu cursei aquele curso, você lembra?
Are you attending?;Você está cursando?
How often do you study history?;Com que frequência você estuda história?
Did she study for the test? ;Ela estudou para a prova?
Study more.;Estude mais.
She doesn't teach my brother.;Ela não ensina meu irmão.
But I hope she will teach.;Mas eu espero que ela ensinará.
The teacher teaches.;O ensinador o ensina.
She doesn't learn.;Ela não aprende.
He has taught everything I have learnt.;Ele ensinou tudo que eu aprendi.
Learn to control your anger. ;Aprenda a controlar a sua raiva.
He has focused./ He has paid attention.;Ele prestou atenção.
Are you pay attention?/ Are you focusing? ;Você está prestando atenção?
I didn't focus yesterday.;Eu não prestei atenção ontem.
She focuses. ;Ela presta atenção!
Read your Bible daily.;Leia a bíblia diariamente.
You need to read Edmund Burke.;Você precisa ler Edmund Burke.
Does she already know to read? ;Ela já sabe ler?
I read earlier.;Eu li mais cedo.
I am gonna read later.;Eu lerei mais tarde.
Have you read that? ;Você leu aquilo?
Do you know reading and writing?;Você sabe ler e escrever?
Would she write to me? ;Ela escreveria para mim?
What do you write so much?;O que você escreve tanto?
Let's make hamburgers this evening.;Vamos fazer hamburgers está noite.
He has made five goals.;Ele fez 5 gols.
I have made a little party.;Eu fiz uma festinha.
Would you like to make a cup of tea? ;Você gostaria de fazer uma xícara de chá?
We made a two-years deal.;Nós fizemos um acordo de dois anos.
I won't make an exception for you.;Eu não farei uma exceção para você.
We need to have faith. ;Nós precisamos ter fé.
Does she need me? ;Ela precisa de mim?
Would I need you? ;Eu precisaria de você?
I need the car yesterday.;Eu precisei do carro ontem.
You don't need to screaming.;Você não precisa gritar.
You need to smile more.;Você precisa sorrir mais.
We need to have a talk.;Nós precisamos ter uma conversa.
What do you need to do?;O que você precisa fazer?
I won't need to wake up early.;Eu não precisarei acordar cedo.
He needs to play with his son.;Ele precisa brincar com o filho dele.
She doesn't try talking to me.;Ela não tenta falar comigo.
Have you tried to make? ;Você tentou fazer?
She tries talking to me.;Ela tenta conversar comigo.
Has she tried to send me the e-mail?;Ela tentou me enviar um e-mail?
I try to be happy.;Eu tento ser feliz.
I would like to try again.;Eu gostaria de tentar de novo.
Hes didn't try to walk last Saturday. ;Ele não tentou caminhar no último sábado.
He has tried to scare the children.;Ele tentou assustar as crianças.
I tried to stop smoking last year.;Eu tentei parar de fumar ano passado.
I have wanted milk.;Eu quis leite.
Does she want water?;Ela quer água?
All I want is arriving home.;Tudo que eu quero é chegar em casa.
She hasn't been adorable like I have wanted.;Ela não foi adorável como eu queria.
Have you wanted to be famous? ;Você quis ser famoso?
I never wanted to hurt her.;Eu nunca quis magoar ela.;Estudar regra do porque não ser o passado sem tempo.
They want to watch that movie.;Eles querem assistir aquele filme.
What do you want to eat on Christmas?;O que você quer comer no natal?
I don't work.;Eu não trabalho.
I wouldn't work as professor.;Eu não trabalharia como professor.
I didn't work last year.;Eu não trabalhei ano passado.
She hasn't worked with my father.;Ela não trabalhava com o meu pai.
But she works.;Mas ela trabalha.
The company has bought steel.;A empresa comprou aço.
Have you bought the refrigerator? ;Você comprou a geladeira?
She would go out to buy a gift.;Ela sairia para comprar um presente.
He wants to buy evetything.;Ele quer comprar tudo.
I have sold three washing machines.;Eu vendi 3 máquinas de lavar.
The selfish guy sells fish.;O cara egoísta vendi peixe.
You haven't paid the bill.;Você não pagou a conta.
You will pay for that.;Você pagará por isso.
Would you pay for this price?;Você pagaria por esse preço?
If you pay, I will thank  ;Se você pagar eu agradecerei.
Have I paid? ;Eu paguei? 
He will deal;Ele negociará.
Does he deal for peace? ;Ele negocia pela paz? 
They have dealt to me.;Eles negociaram comigo.
Do you spend a lot? ;Você gasta muito?
She spends nonstop.;Ela gasta sem parar.
I don't spend time with this.;Eu não gasto tempo com isso.
Are you owing money?;Você está devendo dinheiro?
You owe me.;Você me deve.
How much have you owed? ;Quanto você devia?
He hasn't stopped billing my husband.;Ele não parou de cobrar meu marido.
Have you billed the customer? ;Você cobrou o cliente? 
She bills hardly my father.;Ela cobra duramente o meu pai.
I love you forever.;Eu amo você para sempre.
I loved her for all my life.;Eu amei ela por toda a vida.
I have loved that song.;Eu amava aquela música.
She wouldn't love this hit. ;Ela não amaria esse sucesso musical.
We love walking in the afternoon.;Nós amamos caminhar a tarde.
Has he loved the movie? ;Ele amou o filme?
Does he love the United States?;Ele ama os estados unidos?
We love the freedom.;Nós amamos a liberdade.
The easterns  have loved the westerns.;Os orientais amaram os ocidentais.
I love calling to you.;Eu amo ligar para você.
I don't like vegetables.;Eu não gosto de vegetais.
She didn't like greenery when she was ten. ;Ela não gostava de verduras aos 10 anos.
But now she likes.;Mas agora ela gosta.
She likes because she has tried.;Ela gosta porque ela experimentou.
They don't like eastern culture.;Eles não gostam da cultura oriental.
They like themselves.;Elas gostam delas.
He hates the United Kingdom.;Ele odeia o Reino Unido.
He hates mexican food.;Ele odeia comiga mexicana.
She has hated not having wisdon.;Ela odiava não ter sabedoria.
I hate when you delay. ;Eu odeio quando você se atrasa.
I will rejoice when you win.;Eu me alegrarei quando você vencer.
Would you rejoice with my visit?;Você se alegraria com a minha visita?
She has rejoiced me. ;Ela me alegrou.
There is a man there.;Há um homem lá.
There are thousand men here. ;Há mil homens aqui.
There was a fly in my soup yesterday.;Tinha uma mosca na minha sopa ontem.
There has not been any house there.;Não tinha nenhuma casa lá.
There is nothing here.;Não tem nada aqui.
Was there something good yesterday?;Havia algo bom ontem? 
There has not been no one on the street. ;Não tinha ninguém na rua.
There have been three black cars.;Tinham 3 carros pretos.
Would there be food? ;Haveria comida?
I guess there is food. ;Eu acho que tem comida.
There is not parking where I have parked my car.;Não há estacionamento onde eu estacionei o carro.
There has been a roach.;Tinha uma barata.
There would be somebody.;Teria alguém.
Will there be water for everybody? ;Haverá água para todo mundo? 
Yes, there will be.;Sim, haverá.
I shall go there.;Eu devo ir lá.
I shall travel to South Korea.;Eu devo viajar para a Coréia do Sul.
She shall be arrested.;Ela deve ser presa.
She shall work this Saturday.;Ela deve trabalhar esse sábado.
Shall we go?;Nós devemos ir?
You shall go away.;Você deve ir embora.
I shan't not know. (shall not);Eu não devo saber.
He shall bear this problem.;Ele deve suportar esse problema.
You shall improve your grades.;Vocês devem melhorar suas notas.
They shall begin to study soon.;Ele devem começar a estudar logo.
I should go.;Eu deveria ir.
She should be there.;Ela deveria estar lá.
You should thank me.;Você deveria me agradecer.
She should learn another language.;Ela deveria aprender outra lingua.
I should write a book.;Eu deveria escrever um livro.
It shouldn't stink like this.;Isso não deveria feder assim.
Shouldn't he pay the bills yesterday? ;Ele não deveria pagar as contas ontem?
I should sleep early.;Eu deveria dormir cedo.
He can come here.;Ele pode vir aqui.
I can't run.;Eu não posso correr.
Can you aid me soon?;Você pode me ajudar daqui a pouco?
Can you help us ? ;Você pode nós socorrer?
Can you cook today? ;Você pode cozinhar hoje?
What can happen to me? ;O que pode acontecer comigo?
Who can win the game? ;Quem pode vencer o jogo? 
I can tomorrow.;Eu conseguirei amanhã.
She can.;Ela consegue.
I can drive.;Eu posso dirigir.
He can't drive.;Ele não pode dirigir.
I could see fear in your eyes.;Eu podia ver medo em seus olhos.;Treinar melhor a regra envolvida.
Could you give me the sugar? ;Você poderia me dar o açucar?
He could be more polite.;Ele poderia ser mais educado.
Could she come here tomorrow? ;Ela poderia vir aqui amanhã?
I couldn't do anything.;Eu não poderia fazer nada.
When could you buy newspapers to me? ;Quando você poderia comprar jornais para mim?
What time could you go? ;Que horas você poderia ir?
They couldn't fail this time.;Eles não poderia falhar dessa vez.
Could you bring a glass of water for him, please?;Você poderia trazer um copo d'agua para ele, por favor?
We couldn't travel last year.;Nós não podemos viajar ano passado.
I heard the song yesterday.;Eu ouvi a música ontem.
She hears here.;Ela ouve aqui.
She doesn't hear here.;Ela não ouve aqui.
She hasn't heard.;Ela não ouvia.
I heard you hurted her heart yesterday.;Eu ouvi que você machucou o coração dela ontem.;Acho que aqui o professor errou, pois hurt é verbo irregular, e não deveria ser hurted.
I haven't listened nothing.;Eu não escutei nada.
When I see I don't listen.;Quando eu vejo eu não escuto.
He can't listen you.;Ele não pode escutar você.
Have you felt it? ;Você sentiu isso?
Actually, I feel good.;Na verdade, eu me sinto bem.
I have felt love.;Eu senti amor.
She doesn't feel.;Ela não sente.
I have been feeling.;Eu estava sentindo.
Do you eat with spoon? ;Vocês comem com colher?
She eats with fork and knife.;Ela come com garfo e faca.
Does your brother eat salad? ;Seu irmão come salada?
What do you eat? ;O que você come?
What have you eaten? ;O que você comeu?
He doesn't drink.;Ele não bebe.
She drinks.;Ela bebe.
Does she drink?  ;Ela bebe?
She hasn't drunk, I have drunk.;Ela não bebeu, eu bebi.
I didn't drink yesterday.;Eu não bebi ontem.
I drank yesterday.;Eu bebi ontem.
I saw one of your friends last night.;Eu vi um dos seus amigos noite passada.
She sees her daughter just at the night.;Ela vê sua filha somente a noite.
Did you see the psychobabble yesterday? ;Você viu a besteira ontem?
She saw the psychobabble yesterday.;Ela viu a besteira ontem.
I will see my father.;Eu verei meu pai.
Has she smelt your perfume? ;Ela cherou o seu perfume?
It doesn't smell good.;Isso não cheira bem.
I have smelt his breath, unhappily.;Eu cheirei o hálito dele infelizmente.
Does my hair smell good? ;O meu cabelo cheira bem? 
The girl smelt a rose yesterday.;A garota cherou uma rosa ontem.
My daughter has smiled to me.;Minha filha sorriu para mim.
That guy is charismatic and he smiles to everybody.;Aquele cara é carismático e sorri para todo mundo.
Why didn't you smile yesterday? ;Por que você não sorriu ontem?
I smile almost every time.;Eu sorrio quase toda hora.
Why are you laughing? ;Por que você está rindo? 
I am laughing at you.;Eu estou rindo de você.
I can't stop laughing.;Eu não consigo parar de rir.
She always laughs.;Ela sempre ri.
I laugh in the face of danger.;Eu rio na cara do perigo.
Whe did I cry? ;Quando eu chorei? 
He cries.;Ele chora.
Have you ever cried? ;Você jamais chorou?
He is breathing.;Ele está respirando.
I will breathe even without breath.;Eu respirarei mesmo sem fôlego.
Every fish breathes underwater.;Todo peixe respira dentro da água.
How many hours do you sleep per day? ;Quantas horas você dorme por dia?
I sleep seven hours.;Eu durmo 7 horas.
Yesterday I went to sleep at midnight.;Ontem eu fui dormir meia noite.
What time did you wake? ;Que horas você acordou? 
I woke very early at six in the morning.;Eu acordei bem cedo às seis da manhã.
I usually wake late on Sundays.;Eu geralmente acordo tarde aos domingos.
Where did she live last year?;Onde ela morou ano passado?
The following year I lived in São Paulo. ;O ano seguinte eu morei em Sâo Paulo.
Would you live in Alaska?;Você viveria no Alasca? 
I would die for my dear family.;Eu morreria por minha querida família.
Jesus died in my place.;Jesus morreu em meu lugar.
Jesus died to save a crowd of repentant of sinners;Jesus morreu para salvar uma multidão de pecadores arrependidos.
Would you do? ;Você realizaria?
Will you do? ;Você fará?
I did yesterday.;Eu fiz ontem.
Has he done?;Ele fez?
I wouldn't do.;Eu não faria.
He does.;Ele faz.
You do.;Você faz.
You don't do.;Você não faz.
He will do.;Ele fará.
Will he do?;Ele fará?
Do you do?;Você faz?
Would you do? ;Você faria?
Did you do yesterday? ;Você realizou ontem?
How do you do it? ;Como você faz isso?
I have done a great job.;Eu realizei um grande trabalho.
I usually do my homework after my dinner. ;Eu geralmente faço a minha lição depois do jantar.
They did their best last weekend.;Eles fizeram o seu melhor no último fim de semana.
Can you do me a favor? ;Você pode me fazer um favor?
He does everything for his mother.;Ele faz tudo pela mãe dele.
I have had.;Eu tive.
Does she have? ;Ela tem?
He has.;Ele tem.
She won't have.;Ela não terá.
I would have.;Eu teria.
Did she have yesterday? ;Ela tinha ontem?
He hasn't had.;Ele não tinha.
Have you had? ;Você teve?
Will you have time to study tomorrow? ;Você terá tempo para estudar amanhã? 
Did you have classes yesterday? ;Você teve aulas ontem? 
Will you have kids? ;Você terá filhos? 
She hasn't had good moments, I have had.;Ela não teve bons momentos, eu tive.
Let's have fun.;Deixe-nos ter diversão.
I had three little puppies in my childhood. ;Eu tive 3 cachorrinhos na infância.
I have a good neighborhood.;Eu tenho uma boa vizinhança.
You will have problems, but don't hate it.;Você terá problemas, mas não odei isso.
Do we have  chance? ;Nós temos uma chance?
This guy hasn't had so much luck.;Esse cara não teve muita sorte.
I will have cake and coke.;Eu terei bolo e coca.
I have need for speed.;Eu tenho necessidade de velocidade.
He has a breave heart.;Ele tem um coração valente.
Do you have courage to fight? ;Você tem coragem para lutar? 
I have had five cars.;Eu tinha cinco carros.
You have to have a job. ;Você tem que ter um emprego.
My living room has a nice atmosphere.;Minha sala tem um ambiente legal.
But the outside has a bad environment.;Mas do lado de fora tem um ambiente ruim.
I have had strength, have you had? ;Eu tinha força, você teve? 
Would you have told me? ;Você teria me contado?
She hasn't had luck.;Ela não teve sorte.
I get a bus to my job.;Eu pego ônibus para o trabalho.;com sacrifício (coringas= get or take)
I have taken a bus to the stadium.;Eu peguei um ônibus para o estádio.;sem sacrifício
He has got a car to drive in São Paulo.;Ele alugou um carro para dirigir em São Paulo.;com sacrifício
She took a car to drive in the town yesterday.;Ela alugou um carro para dirigir na cidadizinha ontem.;sem sacrifício
He will get North Pole in Winter.;Ele irá para o Pólo Norte no Inverno.;com sacrifício
We have taken a photo.;Nós tiramos uma foto.;sem sacrifício
She has got portuguese.;Ela aprendeu português.;com sacrifício
You will take english.;Você aprenderá inglês.;sem sacrifício
Have you got it?;Vocês entenderam?;com sacrifício
Have you taken it? ;Vocês entenderam?;sem sacrifício
I have got Chemistry.;Eu entendi química.;com sacrifício
I have taken the tickets.;Eu consegui os ingressos.;sem sacrifício
Where do you get your strength? ;Onde você consegue a sua força?;com sacrifício
Did you take the message yesterday?;Você captou a mensagem ontem?;sem sacrifício
How do you get these things? ;Com você adquiri essas coisas?;com sacrifício
Where do you take these things?;Onde você pega essas coisas?;sem sacrifício
She hasn't said Hi to me.;Ela não disse oi para mim.
I have said.;Eu disse.
She doesn't say Hello.;Ela não diz olá.
I say to you and she says to me.;Eu digo a você e ela diz para mim.
I told yesterday.;Eu contei ontem.
I will tell you the secret.;Eu contarei para você o segredo.
I have told, I will go.;Eu contei que eu irei.
Don't tell lies to me.;Não conte mentiras para mim.
I will speak to fifteen people.;Eu vou falar para 15 pessoas.
The guy just has spoken psychobabble.;O cara só falou bobeira.
I was speaking about this yesterday.;Eu estava falando disso ontem.
Did you talk to me yesterday?;Você conversou comigo ontem?
I talked to my physician this morning.;Eu conversei com o meu médico hoje de manhã.
I am gonna talk tomorrow for sure.;Eu conversarei amanhã com certeza.
I want to sing alone.;Eu quero cantar sozinho.
That singer sings super well.;Aquela cantora canta super bem.
Jonh sings every end of year.;João canta todo fim de ano.
I called to my parents yesterday.;Eu liguei para os meu pais ontem.
I have called to my father, haven't you called? ;Eu liguei para o meu pai, você não ligou?
She will call by names.;Ela chamará pelos nomes.
Do you understand what I mean ? ;Você entende o que eu quero dizer?
It means yes.;Isso quer dizer que sim.
What does it mean? ;O que isso quer dizer?
I know this pizza is yours.;Eu sei que essa pizza é sua.
I have known.;Eu soube.
I have known he hasn't drunk.;Eu soube que ele não bebeu.
She has known she hasn't had.;Ela sabia que ela não tinha.
He knew yesterday.;Ele soube ontem.
I didn't believe in you yesterday.;Eu não acreditei em você ontem.
Do you believe? ;Você acredita? 
She believes in my word.;Ela acredita na minha palavra.
I think so.;Eu penso que sim.
i don't think so.;Eu penso que não.
Is that all you can think? ;Isso é tudo que você pode pensar?
Did you think about my brother yesterday? ;Você pensou sobre o meu irmão ontem?
What do you guess about it? ;O que você acha disso?
I guess that I can.;Eu acho que eu consigo.
He guesses it is possible.;Ele acha que é possível.
I can't understand it.;Eu não consigo entender isso.
