You mother would not approve your attitude.;Sua mãe não aprovaria sua atitude.
It would not cost so expensive.;Isso não custaria tão caro.
It would not improve the situation.;Isso não melhoraria a situação.
She has not worked.
I have not slept.
You have not come.
You have not talked to me.;Você não conversou comigo.
The driver has not stopped.;O motorista não parou.
People have not liked the news.;A pessoas não gostaram das notícias.
I have not painted that wall.
She has not dyed the clothes.;Ela não tingiu a roupas.;clothes serve tanto para singular quanto plural, não existe clothe.
I has not picked your things.;Eu não peguei suas coisas.
I has not caught your things.;Eu não catei suas coisas.;coisas pode ser things ou stuff que são sinônimos em inglês. Sendo que thing existe singular e plural things, e stuff serve para os dois casos, e não existe stuffs.
I has not lent.;Eu não emprestei.
He has not borrowed.;Ele não pegou emprestado.
You have not spent everything.;Você não gastou tudo.
The phone has not rung.;O telefone não tocou.
She has not drunk.;Ela não bebeu.
The singer has not sung.;O cantor não cantou.
The swimmer has not swum.
It has not begun well.;Isso não iniciou bem.
I have not hidden.;Eu não escondi.
I have not been.;Eu não era.
I have not been.;Eu não estava.
It has not been.;Isso não estava.
It has not been working.;Isso não estava funcionando.
You haeve not frozen;Você não congelou.
The freezer has not been freezing.;O congelador não estava congelando.
I don't want;Eu não quero
He doesn't want;Ele não quer 
He won't go;Ele não irá 
She wouldn't be like this.;Ela não estaria assim
You haven't been;Você não estava
You haven't been saying the truth.;Você não estava dizendo a verdade.
You didn't see yesterday.;Você não viu ontem
She isn't waiting.;Ela não está esperando.
My son won't learn.;Meu filho não aprenderá
Actually, he doesn't need to learn theses things.;Na realidade ele não precisa aprender essas coisas.
I don't know what I want.;Eu não sei o que eu quero.
He won't agree.;Ele não concordará
She hasn't cried.;Ela não chorou.
It didn't fit inside the car yesterday.;Isso não coube dentro do carro ontem.
They don't understand economy.;Eles não entendem econômia.
My daughter hasn't been.;Minha filha não estava.
She didn't call me yesterday;Ela não me chamou ontem.
I wouldn't give.;Eu não daria.
She wouldn't forgive.;Ela não perdoaria.
She hasn't forgiven.;Ela não perduou.
You haven't chosen it.;Você não escolheu isso.
She doesn't look like her father.;Ela não parece o pai dela.
He doesn't seem his mother.;Ele não parece a mãe dele.
He didn't smoke last year.;Ele não fumava ano passado.
You weren't smoking yesterday.;Você não estava fumando ontem.
I wouldn't want to say that.;Eu não quereria dizer isso.
I haven't offended her.;Eu não ofendi ela.
I am not seeking him.;Eu não estou procurando ele.
He wouldn't know saying.;Ele não saberia dizer.
She wasn't focusing yesterday.;Ela não estava prestando a atenção ontem.
She won't hear.;Ela não ouvirá.
You haven't tried.;Você não tentou.
I wouldn't spend with this.;Eu não gastaria com isso.
They haven't spent.;Eles não gastaram.
It hasn't ended.;Isso não terminou.
It hasn't been my fault.;Não foi minha culpa.
The player doesn't play since April.;O jogador não joga desde abril.
She didn't marry yet.;Ela não casou ainda.
I wasn't so good last month.;Eu não era tão bom mês passado.
Sometimes I don't listen very well.;As vezes eu não escuto muito bem.
The driver didn't come today.;O motorista não veio hoje.
You aren't a true fighter.;Você não é um verdadeiro lutador.
He hasn't gone to the bank.;Ele não foi ao banco.
It hasn't been spoken.;Isso não foi falado.
She isn't loved.;Ela não é amada.
He isn't drunk.;Ele não está bebado.
You didn't fix the freezer yet.;Você não consertou o congelador ainda.
He hasn't been working.;Ele não estava funcionando.
Don't go without me.;Não vá sem mim.
Don't be like this.;Não seja assim.
I am gonna go.;Eu irei
Are you gonna go? ;Você irá?
She is gonna be? ;Ela estará.
I am gonna say the truth.;Eu direi a verdade.
I am not gonna tell to nobody.;Eu não contarei para ninguém.
I am gonna be busy tomorrow.;Eu estarei ocupado amanhã.
I am gonna be in Campinas.;Eu estarei em Campinas.
He is not gonna go with me.;Ele não irá comigo.
Are you gonna work tomorrow?;Você trabalhará amanhã?
She is gonna study.;Ela estudará.
I am gonna tell you.;Eu contarei para você.
Is she gonna forgive?;Ela perdoará?
I am gonna remember.;Eu lembrarei.
I am gonna attend accountancy.;Eu cursarei contabilidade.
Is he gonna to go to his job?;Ele irá para o trabalho dele?
Are you gonna go with me?;Você irá comigo?
She is gonna go together, don't you think?;Ela quererar ir comigo, você não acha?
He is not gonna answer the phone.;Ele não atenderá o telefone.
I am gonna buy.;Eu comprarei.
We are not gonna forget.;Nós não esqueceremos.
I am not gonna be here tomorrow.;Eu não estarei aqui amanhã.
It is not gonna rain tomorrow.;Não choverá amanhã.
He can come here.;Ele pode vir aqui.
I can't run.;Eu não posso correr.
Can you aid me soon?;Você pode me ajudar daqui a pouco?
Can you help us?;Você pode nós socorrer?
Can you cook today?;Você pode cozinhar hoje?
What can happen to me?;O que pode acontecer comigo?
Who can win the game?;Quem pode vencer o jogo?
I can tomorrow.;Eu conseguirei amanhã.
She can.;Ela consegue.
I can drive.;Eu posso dirigir.
He cannot drive.;Ele não pode dirigir.
I could see fear in your eyes.;Eu podia ver medo em seus olhos.
Could you give me the sugar?;Você poderia me dar o açucar?
He could be more polite.;Ele poderia ser mais educado.
Could she come here tomorrow?;Ela poderia vir aqui amanhã?
I couldn't do anything.;Eu não poderia fazer nada.
When could you buy newspapers to me?;Quando você poderia comprar jornais pra mim?
What time could you go?;Que horas você poderia ir?
They couldn't fail this time.;Eles não poderia falhar dessa vez.
Can you bring a glass of water for him please?;Você poderia trazer um copo d'agua para ele, por favor?
We couldn't travel last year.;Nós não podemos viajar ano passado.
I shall go there.;Eu devo ir lá.
I shall travel to South Korea.;Eu devo viajar para a Korea do Sul.
She shall be arrested.;Ela deve ser presa.
She shall work in this Saturday.;Ela deve trabalhar esse sábado.
Shall we go?;Nós devemos ir?
You shall go away.;Você deve ir embora.
I shan't know.;Eu não devo saber.
He shall bear this problem.;Ele deve suportar esse problema.
You shall improve your grades.;Vocês devem melhorar suas notas.
They shall begin to study soon.;Eles devem começar a estudar logo.
I should go.;Eu deveria ir.
She should be there.;Ela deveria estar lá.
You should thank me;Você deveria me agradecer.
She should learn another language.;Ela deveria aprender outra lingua.
I should write a book.;Eu deveria escrever um livro.
It shouldn't stink like this.;Isso não deveria feder assim.
Shouldn't he pay the bills yesterday?;Ele não deveria pagar as contas ontem?
I should sleep early.;Eu deveria dormir cedo.
I did yesterday.;Eu fiz ontem.
Has he done?;Ele fez?
I would not do;Eu não faria.
He does;Ele faz.
You do.;Você faz.
You do not do.;Você não faz.
He will do;Ele fará.
Will he do?;Ele fará?
Do you do?;Você faz?
Would you do?;Você faria?
Would you do?;Você realizaria?
Did you do yesterday?;Você realizou ontem?
How do you do it?;Como você faz isso?
I have done a great work.;Eu realizei um grande trabalho.
I usually do my homework after my dinner.;Eu geralmente faço minha lição depois do jantar.
They did their best last weekend.;Eles fizeram o seu melhor no último final de semana.
Can you do me a favor?;Você pode me fazer um favor?
He does everything for his mother.;Ele faz tudo pela mãe dele.
I have had.;Eu tive.
Does she have?;Ela tem?
He has.;Ele tem.
She won't have.;Ela não terá.
I would have.;Eu teria.
Did she have yesterday?;Ela tinha ontem?
He hasn't had.;Ele não tinha.
Have you had?;Você teve?
Will you have time to study tomorrow?;Você terá tempo para estudar amanhã?
Did you have classes yesterday?;Você teve aulas ontem?
Will you have kids?;Você terá filhos?
She hasn't had good moments, I have had;Ela não teve bons momentos, eu tive.
Let's have fun.;Deixe-nós ter diversão.
I had three puppies in my childhood.;Eu tive 3 cachorrinhos na infância.
I have a good neighborhood.;Eu tenho uma boa vizinhança.
You will have problems but don't hate it.;Você terá problemas, mas não odei isso.
Do we have a chance?;Nós temos uma chance?
This guy hasn't had so much luck.;Esse cara não teve muita sorte.
I will have cake and coke.;Eu terei bolo e coca.
I have need for speed.;Eu tenho necessidade de velocidade.
He has a brave heart.;Ele tem um coração valente.
Do you have courage to fight?;Você tem coragem para lutar?
I have had five cars.;Eu tinha 5 carros.
You have to have a job.;Você tem que ter um emprego.
My living room has a nice atmosphere.;Minha sala tem um ambiente legal.
But the outside has a bad environment.;Mas o lado de fora tem um ambiente ruim.
I have had strength have you had?;Eu tinha força, você teve?
Would you have told me?;Você teria me contado?
She hasn't had luck.;Ela não teve sorte.
I get a bus to my job.;Eu pego ônibus para o trabalho.;Com sacrifício
I have taken a bus to the stadium.;Eu peguei um onibus para o estádio.;Sem sacrifício
He has got a car to drive in São Paulo.;Ele alugou um carro para dirigir em São Paulo;Com sacrifício
She took a car to drive in the town yesterday.;Ela alugou um carro para dirigir na cidadezinha ontem.;Sem sacrifício
He will get North Pole in Winter.;Ele irá para o polo norte no inverno.;Com sacrifício
We have taken a photo.;Nós tiramos uma foto.;Sem sacrifício
She has got portuguese.;Ela aprendeu português.;Com sacrifício
You will take english.;Você aprenderá inglês.;Sem sacrifício
Have you got it?;Você entenderam?;Com sacrifício
Have you taken it?;Vocês entenderam?;Sem sacrifício
I have got chemistry.;Eu entendi química.;Com sacrifício
I have taken the tickets.;Eu consegui os ingressos .;Sem sacrifício
Where do you get your strangth?;Onde você consegue a sua força?;Com sacrifício
Did you take the message yesterday?;Você captou a mensagem ontem?;Sem sacrifício
How do you get these things?;Como você adquire essas coisas?;Com sacrifício
Where do you take these things?;Onde você pega essas coisas?;Sem sacrifício