What part haven't you understood? ;Que parte você não entendeu? 
They never understand anything.;Eles nunca entendem nada.
Don't forget the unforgettable.;Não esqueça o inesquecível.
Never forget that.;Nunca esqueça isso.
I have gone there, do you remember? ;Eu fui lá, você lembra? 
She remembers.;Ela lembra.
Try to remember.;Tente lembrar.
I am going to (gonna) go;Eu irei.;use gonna
Are you going to (gonna) go? ;Você irá? ;use gonna
She is going to (gonna) be.;Ela estará.;use gonna
I am going to (gonna) say the truth.;Eu direi a verdade.;use gonna
I am not going to (gonna) tell nobody. ;Eu não contarei para ninguém.;use gonna
I am going to (gonna) be busy tomorrow.;Eu estarei ocupado amanhã.;use gonna
I am going to be (gonna) in Campinas.;Eu estarei em Campinas.;use gonna
He is not going to go (gonna) with me.;Ele não irá comigo.;use gonna
Are you going to (gonna) work tomorrow? ;Você trabalhará amanhã?;use gonna
She is going to (gonna) study.;Ela estudará.;use gonna
I am going to (gonna) tell you.;Eu contarei para você.;use gonna
Is she going to (gonna) forgive? ;Ela perdoará? ;use gonna
I am going to (gonna) remember.;Eu lembrarei.;use gonna
I am going to (gonna) attend accountancy.;Eu cursarei contabilidade.;use gonna
Is he going to go to his job? ;Ele irá para o trabalho dele? ;use gonna
Are you going to(gonna) go with me? ;Você irá comigo?;use gonna
She is going to (gonna) go together, don't you think? ;Ela quererar ir junto, você não acha?;use gonna
He isn't going to (gonna) answer the phone.;Ele não atenderá o telefone.;use gonna
I am going to (gonna) buy.;Eu comprarei.;use gonna
We aren't going to (gonna) forget.;Nós não esqueceremos.;use gonna
I am not going to (gonna) be here tomorrow.;Eu não estarei aqui amanhã.;use gonna
It's not going to (gonna) rain tomorrow.;Não choverá amanhã.;use gonna
I wouldn't thank for this.;Eu não agradeceria por isso.
Thank me for that.;Agradeça-me por isso.
Have you thanked him? ;Você agradeceu ele?
She hasn't thanked, but I have thanked.;Ela não agradeceu, mas eu agradeci.
He didn't thank last Saturday.;Ele não agradeceu sábado passado.
He thanked last night.;Ele agradeceu noite passada.
I will thank all day.;Eu agradecerei o dia todo.
He thanks every day.;Ele agradece todo dia.
Thank God.;Graças a Deus.
I give thanks to God for my repentances.;Eu dou graças a Deus pelos meus arrepemdimentos.
They have thanked for fraternity.;Eles agradeceram pela fraternidade.
I will appreciate you.;Eu agradecerei você 1000 %.;agradecer 1000 %
I appreciated him ten minutes ago.;Eu agradeci ele a 10 minutos atrás.;agradecer 1000 %
She has appreciated and she has gone away.;Ela agradeceu e foi embora.;agradecer 1000 %
Have you appreciated her? ;Você agradeceu ela?;agradecer 1000 %
We won't appreciate.;Nós não agradeceremos.;agradecer 1000 %
Would she appreciate you? ;Ela agradeceria você?;agradecer 1000 %
You haven't appreciated me.;Você não me agradeceu.;agradecer 1000 %
Would you please? ;Você agradaria?
Do you please?;Você agrada?
I please.;Eu agrado.
She pleases.;Ela agrada.
Have you pleased?;Você agradou?
Has she pleased?;Ela agradou?
She has pleased.;Ela agradou.
This movie doesn't please.;Esse filme não agrada.
Please me if you forgive me.;Me agrada se você me perdoar.
I would please my wife with gifts.;Eu agradaria a minha esposa com presentes.
Have you pleased the boss?;Você agradou o chefe?
Excuse me.;Desculpe-me.
Ignorance of the law doesn't excuse anybody.;A ignorância da lei não desculpa ninguém.
My daughter won't apologize him.;Minha filha não desculpará ele.
My friend apologized me yesterday.;Meu amigo me desculpou ontem.
He doesn't apologize.;Ele não descupa.
I apologize you.;Eu desculpo você.
She has apologized me.;Ela me desculpou.
Has he apologized you?;Ele desculpou você?
I have apologized because she has been sorry.;Eu desculpei por que ela estava sentida.
I have been sorry and I have apologized him.;Eu estava com pena e desculpei ele.
My apologizies. I am sorry for that.;Desculpa. Eu estou sentido por aquilo.
I want to (wanna) apologize my friend.;Eu quero desculpar meu amigo.
I apologize your fault.;Eu desculpo sua culpa.
I forgive you for that.;Eu perdoo você por isso.
She forgives seventy times seven.;Ela perdoa 70 vezes 7.
You have forgiven.;Você perdoou.
It sounds interesting.;Isso soa interessante.
It hasn't sounded well.;Isso não soou bem.
It doesn't sound bad.;Isso não soa mal.
I look like you.;Eu pareço você.;de aparência
I seem you.;Eu pareço você.;de temperamento
She looks like her mother.;Ela parece a mãe dela.;de aparência
She seems her mother.;Ela parece a mãe dela.;de temperamento
You looked like your father when you were a baby.;Você parecia o seu pai quando você era bebê.;de aparência
He seems fearful.;Ele parece medroso.;de temperamento
Do you look like more your father or your mother? ;Você parece mais o seu pai ou a sua mãe?;de aparência
They seem boring.;Eles parecem chatos.;de temperamento
Does he look like me or look like you? ;Ele parece comigo ou com você?;de aparência
Does he seem to be calm or hot-headed?;Ele parece ser calmo ou temperamental? ;de temperamento
She has been with my father.;Ela estava com o meu pai.
Has she been with my father?;Ela estava com o meu pai?
I have been here.;Eu estava aqui.
Were you here yesterday? ;Você estava aqui ontem?
He has been.;Ele estava.
Has she been wrong?;Ela estava errada?
What is wrong?;O que está errado?
She isn't wrong. I am.;Ela não está errada. Eu estou.
I would be there.;Eu estaria lá.
I have been in Rio de Janeiro.;Eu estive no Rio de Janeiro.
Are you there?;Você está aí?
The most have been understandable.;A maioria era entendível.
That isn't for them.;Isso não é para eles.
My hearth is literally tired;Meu coração está literalmente cansado.
He is hurting her heart.;Ele está machucando o coração dela.
I am not boring.;Eu não sou chato.
The old me was shy.;Antigamente eu era tímido.
The old you were proud.;Antigamente você era orgulhoso.
I am so proud of you.;Eu estou muito orgulhoso de você.
You should be more polite.;Você deveria ser mais educado.
He tries being.;Ela tenta ser.
They were children.;Eles eram crianças.
I was a messy child.;Eu fui uma criança bagunceira.
I am pretty good singing.;Eu sou muito bom em cantar.
The internet has been good.;A internet estava boa.
Is it raining?;Está chovendo?
She will be a good wife.;Ela será uma boa esposa.
We were little children.;Nós eramos pequenas crianças.
He has been right.;Ele estava certo.
Would you be in the office? ;Você estaria no escritório?
I have been in my bedroom.;Eu estive no meu quarto.
The type of car will be that.;O tipo de carro será aquele.
Is not she fine?;Ela não está bem?
I have been thanking her.;Eu estava agradecendo ela.
Why would I be knowing something?;Por que eu estaria sabendo de algo?
Is she your step-sister?;Ela é sua meia irmã?
I am talking to my mother.;Eu estou conversando com minha mãe.
My mother is cooking.;Minha mãe está cozinhando.
My brother-in-law is german.;Meu cunhado é alemão.
I have been working while you have worked.;Eu estava trabalhando enquanto você trabalhava.
The brazilians have been a different folk.;Os brasileiros eram um povo diferente.
What do you want to be?;O que você quer ser?
What were you doing there yesterday?;O que você estava fazendo lá ontem?
I was a fool.;Eu fui um tolo.;Não entendi por que é passado com o tempo, e não passado sem tempo. Deve trata-se de uma exceção que deve ser estudada melhor em sua devida seção, ou através da gramática.
Have I been?;Eu era?;Não entendi por que é passado sem o tempo, levando-se em consideração o exemplo anterior. Deve trata-se de uma exceção que deve ser estudada melhor em sua devida seção, ou através da gramática.
You are a selfish.;Você é um egoísta.
Is she sick ?;Ela está doente?
The room is pleasant.;O espaço é agradável.
Would they be? ;Eles seriam?
The book is over the desk.;O livro está sobre a mesa.
My travel has been unforgettable.;Minha viagem foi inesquecível.
I was fired.;Eu fui demitido.;Não entendi por que é passado com o tempo, e não passado sem tempo. Deve trata-se de uma exceção que deve ser estudada melhor em sua devida seção, ou através da gramática.
Everybody has been in the building.;Todo mundo estava no prédio.
The sick has been cheerful.;O doente estava cheio de alegria.
I am so stupid.;Eu sou muito burro.
I wasn't stupid in school.;Eu não era burro na escola.
I was stupid.;Eu era burro.
He has been watching.;Ele estava assitindo.
She hasn't been old. ;Ela não era velha.;Verificar se o professor respondeu minha dúvida.
She wasn't old in Two Thousand.;Ela não era velha no ano 2000.
He is the bad apple.;Ele é a ovelha negra.;Parafraseando
The winner is the same of the last year.;O vencedor é o mesmo do ano passado.
It is a pleasure to meet you.;É um prazer conhecer você.
Her book is with her.;O livro dela está com ela.
It isn't bullshit.;Isso não é mentira cabeluda.;Parafraseando
Who has been with you?;Quem estava com você?
Whose this key is? ;De quem é está chave?
Has she been a cheerleader? ;Ela era uma lider de torcida?
Are you knowing something?;Você está sabendo de alguma coisa?
Will your friend be in the movies tomorrow? ;Seu amigo estará no cinema amanhã?
Will you be mother? ;Você será mãe?
My grandma was my neighbor in nineties.;Minha vovó era minha vizinha nos anos noventa.
Money isn't everything.;Dinheiro não é tudo.
That is all folks!;Isso é tudo pessoal.
Nothing is impossible to him. ;Nada é impossível para ele.
You haven't been like him.;Você não era como ele.
She is like this since that time. ;Ela está assim desde aquela vez.
I have been on the bottom of the pool.;Eu estava no fundo da piscina.
The type isn't this exactly. ;O tipo não é esse exatamente.
But it has been.;Mas era.
This can be serious. ;Isso pode ser grave.
I was great yesterday.;Eu estive ótimo ontem.
Are you confortable in your job? ;Você está confortável em seu trabalho? 
The dog is arrested by its dog-collar.;O cachorro está preso pela coleira dele.
I am disappointed with myself.;Eu estou desapontado comigo mesmo.
I was being  stupid.;Eu estava sendo burro.
Would you work? 
Are you ready?
Did she know yesterday?;Ela soube ontem?
Have you gone there?;Você foi lá?
Where have you gone?;Onde você foi?
What do you fix?;O que você conserta?
Will you sing?
When will you sing?
Do you eat mexican food?
Was he yesterday?
How was he yesterday?
Has she been good?;Ela estava bem?
When will she help me?;Quando ela me ajudará?
Would I know?;Eu saberia?
What would I know?
Do you believe in the media?;Você acredita na mídia?
Does the media lie? ;A mídia mente?
Does she date?
When were you working?;Quando você estava trabalhando?
How beautiful is she?;Quão bonita ela é?
Has he been polite?;Ele foi educado?
Has he been polite to you?;Ele foi educado com você?
Has my brother been polite to you?;Meu irmão foi educado com você?
Did mey brother talk to you yesterday?;Meu irmão conversou com você ontem?
Would you say me?;Você me diria?
What would she say to me?;O que ela me diria?
Have you been?;Você estava?
Have you been cooking?
Did you try last Sunday?;Você tentou no domingo?
Has she wanted?;Ela queria?
What have you learnt?;O que você aprendeu?
Will you be?;Você estará?
Where are you?;Onde você está?
Have you bought gift?;Você comprou presente?
Where have you bought?;Onde você comprou?
Did it rain last night?;Choveu noite passada?
Is it raining?;Está chovendo?
Where do you hide?;Onde você esconde?
Why do you love me?;Por que você me ama?
Will you pay?;Você pagará?
Has he forgotten?;Ele esqueceu?
What have we forgotten?;O que nós esquecemos?
Does he pray?;Ele ora?
Where do you study?;Onde você estuda?
Where are you studying?;Onde você está estudando?
Would you work in the cemetery?;Você trabalharia no cemitério?
What book did you read last week?;Que livro você leu semana passada?
Who are you?;Quem é você?
Is she writer?;Ela é escritora?
Do you write? 
Does she drive? 
Do you drink? 
Do you pray? 
Do I hate? 
Does she sing? 
Do I agree? 
Does he fight? 
Do I remember? 
Do you want? 
Do you let? 
Does she hear? 
Do you listen?
Do you focus? 
Does it fly? 
Does she write? 
What does she write? 
Do you need? 
What do you need? 
Is he? 
Are you? 
What are you? 
Do you work? 
Where do you work? 
Does he spend? 
Does he spend money? 
Do you surf? 
Where do you surf? 
Do you know?
What do you know?
Do you know cooking? or Do you know to cook?
Do you want? 
Do you want drink? 
Did she dance yesterday?
Did he scream yesterday?
Did you count stars last saturday? 
Did you tell the story yesterday?
Did you speak yesterday?
Did you know to speak English last year? 
Did you say yesterday?
What did you say yesterday?
Did she talk yesterday? 
Did you walk last weekend? 
Did he fix yesterday? 
Did you love yesterday? 
Did you travel last year?
When did you travel? 
Did he grow? 
Did I forget? 
What did I forget? 
When did I lie? 
Were you yesterday? 
Were you happy yesterday? 
Was he yesterday? 
Was he sad yesterday? 
Why was he sad yesterday?
Did it happen?
Did you believe in politicians until last year? 
Did you eat yesterday? 
Did you read your Bible today? 
Did you check the documents? 
Was I sleeping now? 
Was I sleeping during the movie? 
Will you teach? 
Will you go? 
Will you come? 
Will you come back? 
Will you wake early tomorrow? 
Will he watch?
Will he wash the car? 
Will you remember? 
Will she find? 
Will you study economy? ;Or will you study contability? 
Will you travel next week? 
When will you go? 
Will you like? 
Will he clean? 
Will we play soccer?
Will you play guitar? 
Will she play with dolls? 
Will you be? 
Will you be working? 
Will you ask? 
When will you ask? 
Will he file?
Will the judge file?
Will you answer? 
Will you sell? 
Will you buy a new car? 
Will the beautiful girl try? 
Will I feel?
Will I feel pain? 
Will It fit? 
Would you like?
Would you paid?
Would you pay to watch that movie? 
Would she go? 
Would you date with me? 
Would you die? 
Would you die for me? 
Would you be? 
Would I be? 
Would he be crazy? 
Would you mess?
Would mess my life?
Where would you go? 
Would you build? 
Would I follow? 
Would they like? 
Would she hurt my heart? 
Would you live in Rio de Janeiro?
Would she live? 
Would you give me a gift? 
Would you forgive me? 
Would you like to install? 
Would you uninstall? 
Would we learn? 
Would you become? 
Would she hide? 
Would I cry for this? 
Would you thank? 
Would you say it again? 
Have you liked?
Has she loved?;Ela amou?
Have you forgiven?;Você perdou? 
Have you driven?
Have you given money?;Você deu o dinheiro?
Has he spoken?
Have you worked?;Você trabalhou?
Has he believed in you?;Ele acreditou em você?
Has she gone to the bank?;Ela foi ao banco?
Have you agreed?;Você concordou?
Why have you agreed?;Por que você concordou?
Has she sung?;Ela cantou?
How has she sung?;Como ela cantou?
Has Mr. John Piper written?
What has Mr. John Piper written?;O que o senhor John Piper escreveu?
Have you known?
Has the bird flown?
What have you felt?
Have you let?
Have you loved?
Have you drunk water?
Have you fixed?
Have you been?
Has she been fine?
Have you been working?
Have I woken boring?
Have you prayed?
Has he been polite?
Has he liked?
Has my dear friend liked?;Meu querido amigo gostou?
Has my love grown?
Have you wanted?;Você quis?
Have you said?;Você disse?
Have we lived?
Have they spent?;Eles gastaram?
Have I eaten?
Have you taught?
Have you tried?
I work;Eu trabalho
He works
She needs;Ela precisa
He is in home.;Ele está em casa
I love you.;Eu amo você.
I know you.;Eu conheço você.
You eat every time.;Você come toda hora.
I speak english.;Eu falo inglês.
I'm learning.;Eu estou aprendendo.
I aid you.;Eu ajudo você.
I thank you.;Eu agradeço você.
I apreeciate you.
You please me.;Você me agrada.
Enjoy me page.
Kill this fly. 
She judges me.
Move.;Mexa-se.
Eat;Comer.
Eat your food.;Coma a sua comida.
I laugh.;Eu rio.
I know what is happening.;Eu sei o que está acontencendo.
They celebrate with me.;Eles celebram comigo.
Jesus is the King of the kings and Lord of the lords.;Jesus é o reis dos reis e senhor dos senhores.
I mean;Eu quero dizer.
She means.
It means that Jesus is God.;Isso quer dizer que Jesus é Deus.
He begin.;Ele inicia.
I start the game again.;Eu começo o jogo novamente.
He wins.
I lose this figth.;Eu perco essa luta.
The winner is Rocky Balboa. ;O vencedor é Rocky Balboa
He is a loser.;Ele é um perdedor.
My father is writer.;Meu pai é escritor.
My father is writing a lot of articles.;Meu pai está escrevendo um monte de artigos.
Please forget that.;Por favor, esqueça aquilo.
I'm sorry.;Eu estou sentido.
I sleep.;Eu durmo.
I sleep in any place.;Eu durmo em qualquer lugar.
You are a sleeper.;Você é um dorminhoco.
It's raining.;Está chovendo.
It's possible.;É possível.
I lead.;Eu lidero.
He leads.
The leader leads.;O líder lidera.
He is leading.;Ele está liderando.
I ate yesterday.;Eu comi ontem.
He fixed yesterday.;Ele consertou ontem.
It happened;Isso aconteceu.
She was a shy child.;Ela foi uma criança tímida.
He killed the bug today.;Eu matei o inseto hoje.
Yesterday I went.;Ontem eu fui.
Yesterday I went where she was.;Ontem eu fui onde ela estava.
You were scholar when you were young.;Você era estudioso quando jovem.
I asked to you yesterday.
You answered politely.;Você respondeu educadamente.
I forgot to thank you.;Eu esqueci de agradecer você.
I needed to study more yesterday.;Eu precisei de estudar mais ontem.
I dreamed last night.
She called my wife.
He called to me.;Ele ligou para mim.
I will go.;Eu irei.
He will be.;Ele será 
She will be.;Ela estará.
She will dance.
You will agree.
I will find a way.
I will know.
She will trust.
Trust me and you will see.
I will explain
He will develop a project.
I will wait some minutes.;Eu esperarei por alguns minutos.
I will hope.;"Eu esperarei esperançosamente;"
I will expect for my baby.;Eu esperarei por meu bebê.
I will tell you.
You will need a help;Você precisará de uma ajuda.
You will pay for it.;Você pagará por isso.
I will fly to Europe.;Eu voarei a Europa.
I would run.;Eu correria
I would read.
I would use.
She would buy an island.
You would go.
You would go out.
We would show.
I would fall.
My mother would rest in my house.
He would eat an entire ox.;Ele poderia comer um boi inteiro.
She would be an adorable girlfriend.
He would be a strong adversary.
He would be with matters.;Ele estaria com problemas.
You would be with problems.;Você estaria com probleminha.
I would be with an issue.;Eu estaria com um problemão.
I would help you.;Eu socorreria você.
I would call to my mother.
She would believe me.
A virtuous miss would captivate a good man.;Uma moça virtuosa cativaria um bom homem.
I have driven.;Eu dirigi.
She has driven.
I have dated.
He has kept.
We have slept.;Nós dormimos
We have slept here.
You have said.;Você disse.
You have explained.;Você explicou.
You have explained quite well.;;muito com intensidade de 60 por cento.
You have explained so well.;;muito com intensidade de 70 por cento.
You have explained too well.;;muito com intensidade de 80 por cento.
You have explained pretty well.;;muito com intensidade de 90 por cento.
You have explained very well.;;muito com intensidade de 100 por cento.
You have led.
I have known.
It has happened.
He has remenbered.
She has come.
I have read about it.
I have sought.
I have fought.
I have taught.;Eu ensinei.
I have thought.;Eu pensei.
He has thought.;Ele pensou.
She has been.;Ela era.
She has been.;Ela estava.
I have been working.;Eu estava trabalhando.
I eat pizza with catchup;Eu como pizza com catchup
She speaks spanish.;Ela fala espanhol.
They are learning.
You would aid me.;Você me auxiliaria.
They have helped me.;Ele me socorreram.
Please buy one for me ;Por favor compra um para mim.
I will go where she is.;Eu irei onde ela está.
They jugde me.;Eles me julgam.
Run!;Corra! 
He heard my secret yesterday.;Ele ouviu meu segredo ontem.
She works.;Ela trabalha.
We work.
They need.
She means exactly this. ;Ela quer dizer exatamente isso.
You begin the game.;Você inicia o jogo.
I would win.;Eu venceria.
He loses all fights.;Ele perde todas as lutas.
She is at home.;Ela está em casa.
He loves you.;Ele ama você.
She knows you.;Ela conhece você. 
I thank you.;Eu agradeço você. 
She appreciates you.;Ela agredece você mil por cento.
You are losing.;Você está perdendo.
I was right yesterday.;Eu estava certo ontem.
You have known.;Você soube
I woke at 7 in the morning.;Eu acordei as 7 da manhã.
She slept until midday.;Ela dormiu até meio dia.
I would keep it.;Eu manteria isso.
I have thought.;Eu pensei.
I have thought wrong about you.;Eu pensei errado sobre você.
Tell me more about it.;Conte me mais sobre isso.
She loves drinking.;Ela ama beber.
She has wanted more.;Ela quis mais.
I would like to watch.;Eu gostaria de assistir.
You will grow.;Você crescerá.
I will surf there.;Eu surfarei lá.
I have been buying and selling.;Eu estive comprando e vendendo.
I will be.;Eu estarei.
I would be a great husband.;Eu seria um ótimo esposo.
You were awful yesterday.;Você estava horroroso ontem.
Say it again.;Diga isso de novo.
I go where she goes.;Eu vou onde ela vai.
We are inseparables.;Nós somos inseparáveis.
I will explain to you.;Eu explicarei para você.
I drove yesterday.;Eu dirigi ontem.
You pray every night.;Você ora toda noite.
We go to the Church every Sunday.;Nós vamos a igreja todo domingo.
I will trust in you.;Eu confiarei em você.
I wath Paul Washer on Youtube.;Eu assisto Paul no Youtube.
I do not smoke.
He does not smoke.
The law does not let.;A lei não permite.
The law does not let stealing.
I do not guess.;Eu não acho.
I do not guess.;Eu não advinho.
I am not.;Eu não estou.
I am not so bad.;Eu não estou tão mal.
She is not present.;Ela não está presente.
You do not stop speaking.;Você não para de falar
I do not blame you.;Eu não culpo você.
She does not want to stay here.;Ela não quer ficar aqui.
I do not drink.;Eu não bebo.
I do not drink because I am not strong enough.;Eu não bebo por que não sou forte o suficiente.
She does not look.;Ela não olha.
I do not look like you.;Eu não pareço você.(aparência)
I do not seem you.;Eu não pareço você.(temperamento)
My advocate does not fail.;Meu advogado não falha.;pode ser lawyer também.
Open the door.;Abra a porta.
Do not open the door.;Não abra a porta.
Do not scream.
Don't move.
Don't move.
Don't say that.
I did not finish yesterday.;Eu não finalizei ontem
Actually I did not finish yesterday.;Na realidade eu não finalizei ontem.
She did not marry yet.;Ela não casou ainda.
I did not dirty yesterday.;Eu não sujei ontem.
He did not delete that virus today.;Ele não deletou aquele virus hoje.
It did not belong to you before.;Isso não pertencia a você antes.
She did not break in that time.;Ela não brecou naquela hora.
I was not crossing the street.;Eu não estava atravessando a rua.
She did not break when I was crossing the street.;Ela não brecou quando eu estava atravessando a rua.
You did not regret yet;Você não se arrependeu ainda.;pode ser repent tamém.
I did not choose it.;Eu não escolhi isso.
He did not give.
He did not give back. ;Ele não devolveu.
I was not well yesterday.;Eu não estava bem ontem.
You were not a weel behaved child.;Você não foi uma criança bem comportada.
I did not forbid you to go yesterday.;Eu não proibi você de ir ontem.
She did not kiss me last Saturday.;Ela não me beijou sabado passado.
My son was not working yesterday.;Meu filho não estava trabalhando ontem.
You did not close the door yesterday.;Você não encostou a porta ontem.
You did not shut the door yesterday.;Você não fechou a porta ontem.
You did not lock the door yesterday.;Você não trancou a porta ontem.
I will not go.;Eu não irei.
I will not fish.
I will not fish nexts Sunday.
She will not stay.
You will not go out now.;Você não saira agora.
I will not delay.;Eu não demorarei.
I will not pull you up.;Eu não puxarei você para cima.
She will not push you down.;Ela não empurrará você abaixo.
He will not realize.;Ele não perceberá.
She will not see.;Ela não verá.
I will not respect.;Eu não respeitarei.
I will not respect  immoral laws.;Eu não respeitarei leis imorais.
You will not solve.;Você não resolverá.
You will not solve it alone.;Você não resolverá isso sozinho.
I will not repeat it again.;Eu não repetirei isso novamente.
I will not obligate you.;Eu não obrigarei você.
I will not obligate you to love me.
She will not disappoint.;Ela não desapontará.
You will not offend.;Você não ofederá.
He will not be;Ele não estará
He will not be stupid to you.;Ele não será estúpido com você.
My boss will not hire you.;Meu chefe não contratará você.
Our boss will not fire you.;Nosso chefe não demitirá você.
I would not think.;Eu não pensaria.
You would not save.
She would not burn the cake.
He would not seek.;Ele não procuraria.
He would not seach in the internet.;Ele não procuraria na internet.
I google ;Eu procuro na internet
She googles;Ela procura na internet.
I would not be here today.;Eu não estaria aqui hoje.
I  would not be what I am. ;Eu não seria o que sou.
She would not know.;Ela não saberia.
I would not begin like this.;Eu não iniciaria assim.
I would not start like that.;Eu não começaria assim.;pode ser like this or like that nesse caso.
I would not like to meeting you there.;Eu não gostaria de te encontrar lá.
He would not meet.
She would not enjoy it.;Ela não curtiria isso.
I would not die for it.;Eu não morreria por isso.
I would not kill for it too.;Eu não mataria por isso também.
